{
	"schema_version": "1.0.0",
	"package": "vormaclient/client",
	"purpose": "new-conformance-tests",
	"cases": [
		{
			"case_id": "CASE-001-POS",
			"req_id": "REQ-VORMACLIENT-CLIENT-001",
			"api_symbols": ["addStatusListener"],
			"type": "positive",
			"setup": "Create a browser-like test environment with `window` and `CustomEvent`.\nImport `addStatusListener` from the package entrypoint.\n",
			"inputs": {
				"listener_event_key": "vorma:status",
				"dispatched_detail": {
					"isNavigating": false,
					"isSubmitting": false,
					"isRevalidating": false
				}
			},
			"expected": {
				"return_value": {
					"kind": "concrete",
					"value": "cleanup callback function is returned"
				},
				"errors_or_status": {
					"mode": "none",
					"detail": "no thrown error"
				},
				"state_changes": [
					{
						"assertion": "listener call count changes from 0 to 1 after one dispatch"
					}
				],
				"events_emitted": [],
				"network_io": [],
				"dom_effects": []
			},
			"notes": "Assert the listener receives one `CustomEvent` with the exact detail object.\n"
		},
		{
			"case_id": "CASE-001-NEG",
			"req_id": "REQ-VORMACLIENT-CLIENT-001",
			"api_symbols": ["addStatusListener"],
			"type": "negative",
			"setup": "Register one status listener and capture returned cleanup function.\nDispatch one status event, then call cleanup.\n",
			"inputs": {
				"first_dispatch_detail": {
					"isNavigating": true,
					"isSubmitting": false,
					"isRevalidating": false
				},
				"second_dispatch_detail": {
					"isNavigating": false,
					"isSubmitting": true,
					"isRevalidating": false
				}
			},
			"expected": {
				"return_value": {
					"kind": "concrete",
					"value": "cleanup callback function is returned"
				},
				"errors_or_status": {
					"mode": "none",
					"detail": "no thrown error"
				},
				"state_changes": [
					{
						"assertion": "listener call count remains 1 after second dispatch post-cleanup"
					}
				],
				"events_emitted": [],
				"network_io": [],
				"dom_effects": []
			},
			"notes": "Confirms cleanup removes the exact listener from `window`.\n"
		},
		{
			"case_id": "CASE-001-EDGE",
			"req_id": "REQ-VORMACLIENT-CLIENT-001",
			"api_symbols": [
				"addStatusListener",
				"addRouteChangeListener",
				"addLocationListener",
				"addBuildIDListener"
			],
			"type": "edge",
			"setup": "Spy on `window.addEventListener`.\nRegister one listener with each adder export.\n",
			"inputs": {
				"registration_order": [
					"addStatusListener",
					"addRouteChangeListener",
					"addLocationListener",
					"addBuildIDListener"
				]
			},
			"expected": {
				"return_value": {
					"kind": "concrete",
					"value": "four cleanup callback functions are returned"
				},
				"errors_or_status": {
					"mode": "none",
					"detail": "no thrown error"
				},
				"state_changes": [
					{
						"assertion": "addEventListener called exactly 4 times with exact keys"
					}
				],
				"events_emitted": [],
				"network_io": [],
				"dom_effects": []
			},
			"notes": "Assert exact keys: `vorma:status`, `vorma:route-change`, `vorma:location`, `vorma:build-id`.\n"
		},
		{
			"case_id": "CASE-002-POS",
			"req_id": "REQ-VORMACLIENT-CLIENT-002",
			"api_symbols": ["defaultErrorBoundary"],
			"type": "positive",
			"setup": "Import `defaultErrorBoundary` from the package entrypoint.",
			"inputs": {
				"props": {
					"error": "Database offline"
				}
			},
			"expected": {
				"return_value": {
					"kind": "concrete",
					"value": "Route Error: Database offline"
				},
				"errors_or_status": {
					"mode": "none",
					"detail": "no thrown error"
				},
				"state_changes": [],
				"events_emitted": [],
				"network_io": [],
				"dom_effects": []
			},
			"notes": "Exact string equality check.\n"
		},
		{
			"case_id": "CASE-002-NEG",
			"req_id": "REQ-VORMACLIENT-CLIENT-002",
			"api_symbols": ["defaultErrorBoundary"],
			"type": "negative",
			"setup": "Import `defaultErrorBoundary`.",
			"inputs": {
				"props": {
					"error": ""
				}
			},
			"expected": {
				"return_value": {
					"kind": "concrete",
					"value": "Route Error: "
				},
				"errors_or_status": {
					"mode": "none",
					"detail": "no thrown error"
				},
				"state_changes": [],
				"events_emitted": [],
				"network_io": [],
				"dom_effects": []
			},
			"notes": "Empty error string still returns prefix.\n"
		},
		{
			"case_id": "CASE-002-EDGE",
			"req_id": "REQ-VORMACLIENT-CLIENT-002",
			"api_symbols": ["defaultErrorBoundary"],
			"type": "edge",
			"setup": "Import `defaultErrorBoundary`.",
			"inputs": {
				"props": {
					"error": "E/500?x=1#frag"
				}
			},
			"expected": {
				"return_value": {
					"kind": "concrete",
					"value": "Route Error: E/500?x=1#frag"
				},
				"errors_or_status": {
					"mode": "none",
					"detail": "no thrown error"
				},
				"state_changes": [],
				"events_emitted": [],
				"network_io": [],
				"dom_effects": []
			},
			"notes": "Confirms no sanitization or transformation.\n"
		},
		{
			"case_id": "CASE-003-POS",
			"req_id": "REQ-VORMACLIENT-CLIENT-003",
			"api_symbols": ["__vormaClientGlobal"],
			"type": "positive",
			"setup": "Initialize `globalThis[Symbol.for(\"__vorma_internal__\")] = { buildID: \"1\" }`.\nImport `__vormaClientGlobal`.\n",
			"inputs": {
				"set_call": {
					"key": "buildID",
					"value": "123"
				},
				"get_call": {
					"key": "buildID"
				}
			},
			"expected": {
				"return_value": {
					"kind": "concrete",
					"value": "get returns \"123\""
				},
				"errors_or_status": {
					"mode": "none",
					"detail": "no thrown error"
				},
				"state_changes": [
					{
						"assertion": "global symbol object property `buildID` becomes \"123\""
					}
				],
				"events_emitted": [],
				"network_io": [],
				"dom_effects": []
			},
			"notes": "Use strict equality on returned value.\n"
		},
		{
			"case_id": "CASE-003-NEG",
			"req_id": "REQ-VORMACLIENT-CLIENT-003",
			"api_symbols": ["__vormaClientGlobal"],
			"type": "negative",
			"setup": "Delete `globalThis[Symbol.for(\"__vorma_internal__\")]`.\nImport `__vormaClientGlobal`.\n",
			"inputs": {
				"get_call": {
					"key": "buildID"
				}
			},
			"expected": {
				"return_value": {
					"kind": "not_applicable",
					"reason": "exception_thrown"
				},
				"errors_or_status": {
					"mode": "exception_thrown",
					"detail": "throws TypeError on missing symbol-backed object"
				},
				"state_changes": [],
				"events_emitted": [],
				"network_io": [],
				"dom_effects": []
			},
			"notes": "Assert thrown error type only; message text is environment-dependent.\n"
		},
		{
			"case_id": "CASE-003-EDGE",
			"req_id": "REQ-VORMACLIENT-CLIENT-003",
			"api_symbols": ["__vormaClientGlobal"],
			"type": "edge",
			"setup": "Initialize symbol object with `{ params: { a: \"1\" } }`.\nImport `__vormaClientGlobal`.\n",
			"inputs": {
				"set_call": {
					"key": "params",
					"value": {
						"a": "1"
					}
				},
				"external_mutation": {
					"b": "2"
				}
			},
			"expected": {
				"return_value": {
					"kind": "concrete",
					"value": "get(\"params\") returns object containing {a: \"1\", b: \"2\"}"
				},
				"errors_or_status": {
					"mode": "none",
					"detail": "no thrown error"
				},
				"state_changes": [
					{
						"assertion": "stored reference is mutable and not cloned"
					}
				],
				"events_emitted": [],
				"network_io": [],
				"dom_effects": []
			},
			"notes": "Mutate object after set and verify read reflects mutation.\n"
		},
		{
			"case_id": "CASE-004-POS",
			"req_id": "REQ-VORMACLIENT-CLIENT-004",
			"api_symbols": ["getRouterData", "__vormaClientGlobal"],
			"type": "positive",
			"setup": "Set global symbol object to:\n`{ buildID: \"b1\", matchedPatterns: [\"/\"], splatValues: [\"x\"], params: { id: \"7\" }, hasRootData: true, loadersData: [{ root: 1 }] }`.\nImport `getRouterData`.\n",
			"inputs": {
				"call": "getRouterData"
			},
			"expected": {
				"return_value": {
					"kind": "concrete",
					"value": {
						"buildID": "b1",
						"matchedPatterns": ["/"],
						"splatValues": ["x"],
						"params": {
							"id": "7"
						},
						"rootData": {
							"root": 1
						}
					}
				},
				"errors_or_status": {
					"mode": "none",
					"detail": "no thrown error"
				},
				"state_changes": [],
				"events_emitted": [],
				"network_io": [],
				"dom_effects": []
			},
			"notes": "Assert deep equality.\n"
		},
		{
			"case_id": "CASE-004-NEG",
			"req_id": "REQ-VORMACLIENT-CLIENT-004",
			"api_symbols": ["getRouterData", "__vormaClientGlobal"],
			"type": "negative",
			"setup": "Set global symbol object with `hasRootData: false` and `loadersData: [{ root: 1 }]`.\nImport `getRouterData`.\n",
			"inputs": {
				"call": "getRouterData"
			},
			"expected": {
				"return_value": {
					"kind": "concrete",
					"value": {
						"rootData": null
					}
				},
				"errors_or_status": {
					"mode": "none",
					"detail": "no thrown error"
				},
				"state_changes": [],
				"events_emitted": [],
				"network_io": [],
				"dom_effects": []
			},
			"notes": "Root data must be null when `hasRootData` is false.\n"
		},
		{
			"case_id": "CASE-004-EDGE",
			"req_id": "REQ-VORMACLIENT-CLIENT-004",
			"api_symbols": ["getRouterData", "__vormaClientGlobal"],
			"type": "edge",
			"setup": "Set global symbol object to empty object `{}`.\nImport `getRouterData`.\n",
			"inputs": {
				"call": "getRouterData"
			},
			"expected": {
				"return_value": {
					"kind": "concrete",
					"value": {
						"buildID": "",
						"matchedPatterns": [],
						"splatValues": [],
						"params": {},
						"rootData": null
					}
				},
				"errors_or_status": {
					"mode": "none",
					"detail": "no thrown error"
				},
				"state_changes": [],
				"events_emitted": [],
				"network_io": [],
				"dom_effects": []
			},
			"notes": "Validates all documented defaults.\n"
		},
		{
			"case_id": "CASE-005-POS",
			"req_id": "REQ-VORMACLIENT-CLIENT-005",